LINK,NAME
https://static.india.gov.in/npiprod/uploads/vikram_nath_6d0e1bfe7c.jpg,Hon'ble Mr. Justice Vikram Nath
https://static.india.gov.in/npiprod/uploads/jk_maheshwari_34843bb634.jpg,Hon'ble Mr. Justice J.K. Maheshwari
https://static.india.gov.in/npiprod/uploads/bv_nagarathna_be461fae01.jpg,Hon'ble Mrs. Justice B.V. Nagarathna
https://static.india.gov.in/npiprod/uploads/mm_sundresh_e7bf699e3d.jpg,Hon'ble Mr. Justice M.M. Sundresh
https://static.india.gov.in/npiprod/uploads/pamidighantam_sri_narasimha_70b342b65f.jpg,Hon'ble Mr. Justice Pamidighantam Sri Narasimha
https://static.india.gov.in/npiprod/uploads/jb_pardiwala_af44252d8c.jpg,Hon'ble Mr. Justice J.B. Pardiwala
https://static.india.gov.in/npiprod/uploads/dipankar_datta_913702576e.jpg,Hon'ble Mr. Justice Dipankar Datta
https://static.india.gov.in/npiprod/uploads/pankaj_mithal_2db565f296.jpg,Hon'ble Mr. Justice Pankaj Mithal
https://static.india.gov.in/npiprod/uploads/sanjay_karol_74026aa96b.jpg,Hon'ble Mr. Justice Sanjay Karol
https://static.india.gov.in/npiprod/uploads/sanjay_kr_ab5ec0aef8.jpg,Hon'ble Mr. Justice Sanjay Kumar
https://static.india.gov.in/npiprod/uploads/ahsanuddin_amanullah_897ce5edce.JPG,Hon'ble Mr. Justice Ahsanuddin Amanullah
https://static.india.gov.in/npiprod/uploads/manoj_misra_25fe3f38cd.jpg,Hon'ble Mr. Justice Manoj Misra
https://static.india.gov.in/npiprod/uploads/rajesh_bindal_4b01e7e19e.jpg,Hon'ble Mr. Justice Rajesh Bindal
https://static.india.gov.in/npiprod/uploads/aravind_kumar_48b91a2e53.jpg,Hon'ble Mr. Justice Aravind Kumar
https://static.india.gov.in/npiprod/uploads/prashant_kumar_ff5f0dabda.jpg,Hon'ble Mr. Justice Prashant Kumar Mishra
https://static.india.gov.in/npiprod/uploads/K_V_Viswanathan_ffe8c25b60.jpg,Hon'ble Mr. Justice K.V. Viswanathan
https://static.india.gov.in/npiprod/uploads/ujjal_bhuya_7e83905a97.JPG,Hon'ble Mr. Justice Ujjal Bhuyan
https://static.india.gov.in/npiprod/uploads/sarasa_venkatanarayana_bhatti_b5eb4c0202.JPG,Hon'ble Mr. Justice Sarasa Venkatanarayana Bhatti
https://static.india.gov.in/npiprod/uploads/Satish_Chandra_Sharma_15286d095e.jpg,Hon'ble Mr. Justice Satish Chandra Sharma
https://static.india.gov.in/npiprod/uploads/Augustine_George_Masih_575054db21.jpg,Hon'ble Mr. Justice Augustine George Masih
https://static.india.gov.in/npiprod/uploads/Sandeep_Mehta_942a0c89ee.jpg,Hon'ble Mr. Justice Sandeep Mehta
https://static.india.gov.in/npiprod/uploads/Prasanna_Bhalachandra_Varale_2f7ef0c2a6.jpg,Hon'ble Mr. Justice Prasanna Bhalachandra Varale
https://static.india.gov.in/npiprod/uploads/N_Kotiswar_Singh_673e82eae3.jpg,Hon'ble Mr. Justice N Kotiswar Singh
https://static.india.gov.in/npiprod/uploads/R_Mahadevan_caa55f5b60.jpg,Hon'ble Mr. Justice R Mahadevan
https://static.india.gov.in/npiprod/uploads/2024121925_7ee1d79c91.jpg,Hon'ble Mr. Justice Manmohan
https://static.india.gov.in/npiprod/uploads/Justice_K_Vinod_Chandran_a1123cf4fd.jpg,Hon'ble Mr. Justice K. Vinod Chandran
https://static.india.gov.in/npiprod/uploads/2025032612_62dfa96301.jpeg,Hon'ble Mr. Justice Joymalya Bagchi
https://static.india.gov.in/npiprod/uploads/Justice_Nilay_Vipinchandra_Anjaria_b5229ffc08.jpg,Hon'ble Mr. Justice Nilay Vipinchandra Anjaria
https://static.india.gov.in/npiprod/uploads/Justice_Vijay_Bishnoi_1_dcea7ee1bc.jpg,Hon'ble Mr. Justice Vijay Bishnoi
https://static.india.gov.in/npiprod/uploads/Justice_Atul_Sharachchandra_Chandurkar_1_cf6598c9c9.jpg,Hon'ble Mr. Justice Atul Sharachchandra Chandurkar
https://static.india.gov.in/npiprod/uploads/Justice_Alok_Aradhe_586f8834da.jpg,Hon'ble Mr. Justice Alok Aradhe
https://static.india.gov.in/npiprod/uploads/Justice_Vipul_Manubhai_Pancholi_e0ed5e548e.jpg,Hon'ble Mr. Justice Vipul Manubhai Pancholi